{
  "$schema": "https://json-schema.org/draft/2020-12/schema",
  "$id": "https://aoa.local/aoa-stats/schemas/policy_decision_metric_summary_v1.json",
  "title": "Policy Decision Metric Summary V1",
  "type": "object",
  "additionalProperties": false,
  "required": [
    "authority",
    "created_at",
    "decision_refs",
    "evidence_refs",
    "id",
    "kind",
    "metrics",
    "notes",
    "schema_version",
    "status"
  ],
  "properties": {
    "authority": {
      "type": "object",
      "additionalProperties": false,
      "required": [
        "actor",
        "mode"
      ],
      "properties": {
        "actor": {
          "type": "string",
          "minLength": 1
        },
        "mode": {
          "type": "string",
          "minLength": 1,
          "enum": [
            "reviewed"
          ]
        }
      }
    },
    "created_at": {
      "type": "string",
      "minLength": 1
    },
    "decision_refs": {
      "type": "array",
      "items": {
        "type": "string",
        "minLength": 1
      }
    },
    "evidence_refs": {
      "type": "array",
      "items": {
        "type": "string",
        "minLength": 1
      },
      "minItems": 1
    },
    "id": {
      "type": "string",
      "minLength": 1
    },
    "kind": {
      "type": "string",
      "minLength": 1,
      "const": "stats.policy_decision_summary"
    },
    "metrics": {
      "type": "object",
      "additionalProperties": false,
      "required": [
        "precedents",
        "revoked"
      ],
      "properties": {
        "precedents": {
          "type": "integer",
          "minimum": 0
        },
        "revoked": {
          "type": "integer",
          "minimum": 0
        }
      }
    },
    "notes": {
      "type": "array",
      "items": {
        "type": "string",
        "minLength": 1
      },
      "minItems": 1
    },
    "schema_version": {
      "type": "string",
      "minLength": 1,
      "const": "v1"
    },
    "status": {
      "type": "string",
      "minLength": 1,
      "enum": [
        "proposed"
      ]
    }
  }
}
