{
  "authority": {
    "actor": "operator.sovereign",
    "mode": "reviewed"
  },
  "created_at": "2026-04-22T12:00:00-06:00",
  "decision_refs": [],
  "evidence_refs": [
    "receipt:example:001"
  ],
  "id": "stats.policy_decision_summary.example.001",
  "kind": "stats.policy_decision_summary",
  "metrics": {
    "precedents": 2,
    "revoked": 0
  },
  "notes": [
    "seed example for v0.8 polis governance"
  ],
  "schema_version": "v1",
  "status": "proposed"
}
